ticker,event_date,v_actual_date,event_type,move_pct,atr_pct,normalized_move,close,market_cap_m,nct_id,drug_name,indication,ct_conditions,ct_phase,ct_enrollment,ct_status,ct_sponsor,ct_official_title,ct_allocation,ct_primary_completion,catalyst_type,v_is_material,data_tier,match_type,days_offset,move_class_abs,stock_movement_atr_normalized,move_class_norm,target_large_move
BNTC,2018-12-07,2018-12-07,Loser,-10.28,9.72,1.06,489.6,373.4,NCT03433027,BB-401,Head and Neck Squamous Cell Carcinoma,Head and Neck Squamous Cell Carcinoma,PHASE2,16,COMPLETED,"Benitec Biopharma, Inc.",A Phase 2 Trial of Intratumoral EGFR Antisense DNA (BB-401) in Patients With Recurrent or Metastatic Squamous Cell Carcinoma of the Head and Neck (HNSCC) Who Have Failed All Available Standard Therapies,NA,2018-12-12,Clinical Data,True,ctgov_crossmatch,ctgov_cross_match,5,High,1.058,Noise,0
ENTX,2018-12-10,2018-12-10,Gainer,10.02,5.18,1.93,5.49,63.7,NCT03516773,EB612 (EBP05),Hypoparathyroidism,Hypoparathyroidism,PHASE2,20,COMPLETED,Entera Bio Ltd.,An Evaluation of the Pharmacokinetics and Pharmacodynamics of Oral Parathyroid Hormone [PTH (1-34)] and NATPARA® in Patients With Hypoparathyroidism,RANDOMIZED,2018-12-05,Clinical Data,True,ctgov_crossmatch,ctgov_cross_match,5,High,1.934,Low,0
NRC,2018-12-11,2018-12-11,Gainer,0.96,,,34.03,303.8,NCT03998969,Pantoprazole,Esophageal Disease,Esophageal Disease,PHASE3,70,COMPLETED,Seoul National University Hospital,,,,Clinical Data,True,ctgov_completion,ctgov_neg_sample,0,Low,,,0
ENTX,2018-12-11,2018-12-11,Loser,-10.93,6.88,1.59,4.89,63.7,NCT03516773,EB612 (EBP05),Hypoparathyroidism,Hypoparathyroidism,PHASE2,20,COMPLETED,Entera Bio Ltd.,An Evaluation of the Pharmacokinetics and Pharmacodynamics of Oral Parathyroid Hormone [PTH (1-34)] and NATPARA® in Patients With Hypoparathyroidism,RANDOMIZED,2018-12-05,Clinical Data,True,ctgov_crossmatch,ctgov_cross_match,6,High,1.589,Low,0
LLY,2018-12-11,2018-12-11,Gainer,0.36,,,104.0,,NCT02891226,Mirikizumab,Crohn's Disease,Crohn's Disease,PHASE2,191,COMPLETED,Eli Lilly and Company,,,,Clinical Data,True,ctgov_completion,ctgov_neg_sample,0,Low,,,0
ENTX,2018-12-14,2018-12-14,Loser,-10.0,9.17,1.09,3.96,63.7,NCT03516773,EB612 (EBP05),Hypoparathyroidism,Hypoparathyroidism,PHASE2,20,COMPLETED,Entera Bio Ltd.,An Evaluation of the Pharmacokinetics and Pharmacodynamics of Oral Parathyroid Hormone [PTH (1-34)] and NATPARA® in Patients With Hypoparathyroidism,RANDOMIZED,2018-12-05,Clinical Data,True,ctgov_crossmatch,ctgov_cross_match,9,High,1.091,Noise,0
NRC,2018-12-14,2018-12-14,Loser,-0.28,,,33.63,303.8,NCT00003838,T-cell replete PBPC allograft,Myeloproliferative Disorders; Acute Myelogenous Leukemia; Chronic Myelogenous Leukemia; Myelodysplastic Syndrome; Acute Lymphoblastic Leukemia,Myeloproliferative Disorders; Acute Myelogenous Leukemia; Chronic Myelogenous Leukemia; Myelodysplastic Syndrome; Acute Lymphoblastic Leukemia,PHASE2,202,COMPLETED,"National Heart, Lung, and Blood Institute (NHLBI)",,,,Clinical Data,True,ctgov_completion,ctgov_neg_sample,0,Low,,,0
SRPT,2018-12-17,2018-12-17,Loser,-3.2,,,115.7,1756.2,NCT02420379,eteplirsen,Duchenne Muscular Dystrophy (DMD),Duchenne Muscular Dystrophy (DMD),PHASE2,33,COMPLETED,"Sarepta Therapeutics, Inc.",,,,Clinical Data,True,ctgov_completion,ctgov_neg_sample,0,Low,,,0
VRTX,2018-12-18,2018-12-18,Loser,-1.65,,,163.43,,NCT03068312,Ivacaftor,Cystic Fibrosis,Cystic Fibrosis,PHASE3,38,COMPLETED,Vertex Pharmaceuticals Incorporated,,,,Clinical Data,True,ctgov_completion,ctgov_neg_sample,0,Low,,,0
BNTC,2018-12-19,2018-12-19,Loser,-11.62,8.13,1.43,446.25,373.4,NCT03433027,BB-401,Head and Neck Squamous Cell Carcinoma,Head and Neck Squamous Cell Carcinoma,PHASE2,16,COMPLETED,"Benitec Biopharma, Inc.",A Phase 2 Trial of Intratumoral EGFR Antisense DNA (BB-401) in Patients With Recurrent or Metastatic Squamous Cell Carcinoma of the Head and Neck (HNSCC) Who Have Failed All Available Standard Therapies,NA,2018-12-12,Clinical Data,True,ctgov_crossmatch,ctgov_cross_match,7,High,1.429,Noise,0
BNTC,2018-12-21,2018-12-21,Loser,-20.81,11.74,1.77,357.0,373.4,NCT03433027,BB-401,Head and Neck Squamous Cell Carcinoma,Head and Neck Squamous Cell Carcinoma,PHASE2,16,COMPLETED,"Benitec Biopharma, Inc.",A Phase 2 Trial of Intratumoral EGFR Antisense DNA (BB-401) in Patients With Recurrent or Metastatic Squamous Cell Carcinoma of the Head and Neck (HNSCC) Who Have Failed All Available Standard Therapies,NA,2018-12-12,Clinical Data,True,ctgov_crossmatch,ctgov_cross_match,9,Extreme,1.773,Low,0
CLDX,2018-12-21,2018-12-21,Loser,-13.04,12.25,1.06,3.0,1999.5,NCT02335918,Combination of varlilumab and nivolumab,Squamous Cell Carcinoma of the Head and Neck (SCCHN); Ovarian Carcinoma-Enrollment Completed; Colorectal Cancer (CRC)-Enrollment Completed; Renal Cell Carcinoma (RCC) (Phase ll Only); Glioblastoma (GBM) (Phase ll Only)-Enrollment Completed,Squamous Cell Carcinoma of the Head and Neck (SCCHN); Ovarian Carcinoma-Enrollment Completed; Colorectal Cancer (CRC)-Enrollment Completed; Renal Cell Carcinoma (RCC) (Phase ll Only); Glioblastoma (GBM) (Phase ll Only)-Enrollment Completed,PHASE1/PHASE2,175,COMPLETED,Celldex Therapeutics,"A Phase l/ll Dose Escalation and Cohort Expansion Study of the Safety, Tolerability and Efficacy of Anti-CD27 Antibody (Varlilumab) Administered in Combination With Anti-PD-1 (Nivolumab) in Advanced Refractory Solid Tumors",NA,2018-12-12,Clinical Data,True,ctgov_crossmatch,ctgov_cross_match,9,High,1.064,Noise,0
NVAX,2018-12-26,2018-12-26,Gainer,15.61,9.35,1.67,40.0,1647.7,NCT02624947,RSV F vaccine with adjuvant,Respiratory Syncytial Virus Infections,Respiratory Syncytial Virus Infections,PHASE3,4636,COMPLETED,Novavax,"A Phase 3, Randomized, Observer-Blind, Placebo-Controlled, Group-Sequential Study to Determine the Immunogenicity and Safety of a Respiratory Syncytial Virus (RSV) F Nanoparticle Vaccine With Aluminum in Healthy Third-trimester Pregnant Women; and Safety and Efficacy of Maternally Transferred Antibodies in Preventing RSV Disease in Their Infants",RANDOMIZED,2018-12-28,Clinical Data,True,ctgov_crossmatch,ctgov_cross_match,2,High,1.67,Low,0
VRTX,2018-12-28,2018-12-28,Loser,-0.59,,,161.42,,NCT03525548,VX-445/TEZ/IVA,Cystic Fibrosis,Cystic Fibrosis,PHASE3,113,COMPLETED,Vertex Pharmaceuticals Incorporated,,,,Clinical Data,True,ctgov_completion,ctgov_neg_sample,0,Low,,,0
NRC,2018-12-30,2018-12-30,Loser,-1.37,,,33.21,303.8,NCT04596696,Rotavac,Rotavirus Gastroenteritis,Rotavirus Gastroenteritis,PHASE3,360,COMPLETED,Bharat Biotech International Limited,,,,Clinical Data,True,ctgov_completion,ctgov_neg_sample,0,Low,,,0
NRC,2018-12-31,2018-12-31,Loser,-1.37,,,33.21,303.8,NCT02629523,Afatinib,Lung Neoplasms; EGFR Gene Mutation,Lung Neoplasms; EGFR Gene Mutation,PHASE2,21,COMPLETED,Chonnam National University Hospital,,,,Clinical Data,True,ctgov_completion,ctgov_neg_sample,0,Low,,,0
AXSM,2018-12-31,2018-12-31,Gainer,29.36,10.38,2.83,2.82,8383.5,NCT03595579,AXS-05,Major Depressive Disorder,Major Depressive Disorder,PHASE2,97,COMPLETED,"Axsome Therapeutics, Inc.","A Randomized, Double-Blind, Active-Controlled Trial of AXS-05 Administered Orally to Subjects With Major Depressive Disorder",RANDOMIZED,2019-01-07,Clinical Data,True,ctgov_crossmatch,ctgov_cross_match,7,Extreme,2.829,Low,0
NRC,2018-12-31,2018-12-31,Loser,-1.37,,,33.21,303.8,NCT02886624,Grazoprevir/Elbasvir,Acute Hepatitis C; HIV,Acute Hepatitis C; HIV,PHASE2,30,COMPLETED,Institut de Médecine et d'Epidémiologie Appliquée - Fondation Internationale Léon M'Ba,,,,Clinical Data,True,ctgov_completion,ctgov_neg_sample,0,Low,,,0
NRC,2018-12-31,2018-12-31,Loser,-1.37,,,33.21,303.8,NCT04180774,Tag-7 gene modified inactivated tumor cells,Melanoma; Kidney Cancer,Melanoma; Kidney Cancer,PHASE1/PHASE2,80,COMPLETED,N.N. Petrov National Medical Research Center of Oncology,,,,Clinical Data,True,ctgov_completion,ctgov_neg_sample,0,Low,,,0
MRK,2019-01-02,2019-01-02,Loser,-1.07,,,57.64,,NCT02702401,Pembrolizumab,Hepatocellular Carcinoma,Hepatocellular Carcinoma,PHASE3,413,COMPLETED,Merck Sharp & Dohme LLC,,,,Clinical Data,True,ctgov_completion,ctgov_neg_sample,0,Low,,,0
NRC,2019-01-07,2019-01-07,Gainer,0.71,,,33.39,303.8,NCT02773459,MEK162+capecitabine,Biliary Tract Cancer,Biliary Tract Cancer,PHASE1/PHASE2,31,COMPLETED,Seoul National University Hospital,,,,Clinical Data,True,ctgov_completion,ctgov_neg_sample,0,Low,,,0
AXSM,2019-01-07,2019-01-07,Gainer,161.22,8.62,18.71,6.87,8383.5,NCT03595579,AXS-05,Major Depressive Disorder,Major Depressive Disorder,PHASE2,97,COMPLETED,"Axsome Therapeutics, Inc.","A Randomized, Double-Blind, Active-Controlled Trial of AXS-05 Administered Orally to Subjects With Major Depressive Disorder",RANDOMIZED,2019-01-07,Clinical Data,True,ctgov_crossmatch,ctgov_cross_match,0,Extreme,18.703,Extreme,1
AXSM,2019-01-08,2019-01-08,Gainer,29.26,7.76,3.77,8.88,8383.5,NCT03595579,AXS-05,Major Depressive Disorder,Major Depressive Disorder,PHASE2,97,COMPLETED,"Axsome Therapeutics, Inc.","A Randomized, Double-Blind, Active-Controlled Trial of AXS-05 Administered Orally to Subjects With Major Depressive Disorder",RANDOMIZED,2019-01-07,Clinical Data,True,ctgov_crossmatch,ctgov_cross_match,1,Extreme,3.771,Medium,1
AXSM,2019-01-09,2019-01-09,Loser,-14.98,9.6,1.56,7.55,8383.5,NCT03595579,AXS-05,Major Depressive Disorder,Major Depressive Disorder,PHASE2,97,COMPLETED,"Axsome Therapeutics, Inc.","A Randomized, Double-Blind, Active-Controlled Trial of AXS-05 Administered Orally to Subjects With Major Depressive Disorder",RANDOMIZED,2019-01-07,Clinical Data,True,ctgov_crossmatch,ctgov_cross_match,2,High,1.56,Low,0
GILD,2019-01-10,2019-01-10,Gainer,0.15,,,51.67,,NCT03100942,Lanraplenib,Sjogren's Syndrome,Sjogren's Syndrome,PHASE2,152,COMPLETED,Gilead Sciences,,,,Clinical Data,True,ctgov_completion,ctgov_neg_sample,0,Low,,,0
NRC,2019-01-11,2019-01-11,Loser,-1.0,,,33.51,303.8,NCT02862171,Dapivirine Vaginal Ring-004,HIV Prevention,HIV Prevention,PHASE3,941,COMPLETED,"International Partnership for Microbicides, Inc.",,,,Clinical Data,True,ctgov_completion,ctgov_neg_sample,0,Low,,,0
MRK,2019-01-14,2019-01-14,Loser,-2.04,,,55.95,,NCT01178411,Tivantinib,Advanced Solid Tumors,Advanced Solid Tumors,PHASE1/PHASE2,60,COMPLETED,"ArQule, Inc., a subsidiary of Merck Sharp & Dohme LLC, a subsidiary of Merck & Co., Inc. (Rahway, NJ USA)",,,,Clinical Data,True,ctgov_completion,ctgov_neg_sample,0,Low,,,0
LLY,2019-01-18,2019-01-18,Loser,-2.16,,,105.9,,NCT02959177,Galcanezumab,Migraine,Migraine,PHASE2,459,COMPLETED,Eli Lilly and Company,,,,Clinical Data,True,ctgov_completion,ctgov_neg_sample,0,Low,,,0
SNY,2019-01-19,2019-01-19,Gainer,0.02,,,31.52,,NCT03700242,HDCV,Healthy Volunteers (Rabies Immunization),Healthy Volunteers (Rabies Immunization),PHASE3,570,COMPLETED,"Sanofi Pasteur, a Sanofi Company",,,,Clinical Data,True,ctgov_completion,ctgov_neg_sample,0,Low,,,0
SNY,2019-01-21,2019-01-21,Gainer,0.02,,,31.52,,NCT01515748,Docetaxel (XRP6976),Gastric Cancer,Gastric Cancer,PHASE3,530,COMPLETED,Sanofi,,,,Clinical Data,True,ctgov_completion,ctgov_neg_sample,0,Low,,,0
AZN,2019-01-25,2019-01-25,Loser,-0.11,,,59.4,,NCT01991795,Ticagrelor 60 mg,"Diabetes Mellitus, Type 2","Diabetes Mellitus, Type 2",PHASE3,19271,COMPLETED,AstraZeneca,,,,Clinical Data,True,ctgov_completion,ctgov_neg_sample,0,Low,,,0
BCRX,2019-01-25,2019-01-25,Gainer,10.33,5.06,2.04,9.72,2190.7,NCT03240133,BCX7353,Hereditary Angioedema (HAE),Hereditary Angioedema (HAE),PHASE2,58,COMPLETED,BioCryst Pharmaceuticals,"A Randomized, Double-blind, Placebo-controlled, Dose-ranging, Study to Evaluate the Efficacy, Safety and Tolerability of Single Doses of BCX7353 as an Acute Attack Treatment in Subjects With Hereditary Angioedema",RANDOMIZED,2019-01-29,Clinical Data,True,ctgov_crossmatch,ctgov_cross_match,4,High,2.042,Low,0
NRC,2019-01-31,2019-01-31,Gainer,1.91,,,34.81,303.8,NCT02019667,SGS-742,Metabolic Disease; Seizures,Metabolic Disease; Seizures,PHASE2,19,COMPLETED,National Institute of Neurological Disorders and Stroke (NINDS),,,,Clinical Data,True,ctgov_completion,ctgov_neg_sample,0,Low,,,0
HRTX,2019-01-31,2019-01-31,Loser,-0.3,,,26.9,218.2,NCT03718039,HTX-011,Postoperative Pain,Postoperative Pain,PHASE2,78,COMPLETED,Heron Therapeutics,,,,Clinical Data,True,ctgov_completion,ctgov_neg_sample,0,Low,,,0
NRC,2019-01-31,2019-01-31,Gainer,1.91,,,34.81,303.8,NCT02989857,AG-120,Advanced Cholangiocarcinoma; Metastatic Cholangiocarcinoma,Advanced Cholangiocarcinoma; Metastatic Cholangiocarcinoma,PHASE3,187,COMPLETED,Institut de Recherches Internationales Servier,,,,Clinical Data,True,ctgov_completion,ctgov_neg_sample,0,Low,,,0
ALNY,2019-01-31,2019-01-31,Gainer,2.24,,,83.53,,NCT03338816,Givosiran,"Acute Hepatic Porphyria; Acute Intermittent Porphyria; Porphyria, Acute Intermittent; Acute Porphyria; Hereditary Coproporphyria (HCP); Variegate Porphyria (VP); ALA Dehydratase Deficient Porphyria (ADP)","Acute Hepatic Porphyria; Acute Intermittent Porphyria; Porphyria, Acute Intermittent; Acute Porphyria; Hereditary Coproporphyria (HCP); Variegate Porphyria (VP); ALA Dehydratase Deficient Porphyria (ADP)",PHASE3,94,COMPLETED,Alnylam Pharmaceuticals,,,,Clinical Data,True,ctgov_completion,ctgov_neg_sample,0,Low,,,0
NVS,2019-02-08,2019-02-08,Gainer,0.6,,,59.33,,NCT02468232,LCZ696,Heart Failure With Reduced Ejection Fraction (HF-rEF),Heart Failure With Reduced Ejection Fraction (HF-rEF),PHASE3,225,COMPLETED,Novartis Pharmaceuticals,,,,Clinical Data,True,ctgov_completion,ctgov_neg_sample,0,Low,,,0
NRC,2019-02-09,2019-02-09,Loser,-0.21,,,33.89,303.8,NCT02315430,Cabozantinib S-malate,Fallopian Tube Clear Cell Adenocarcinoma; Ovarian Clear Cell Adenocarcinoma; Recurrent Fallopian Tube Carcinoma; Recurrent Ovarian Carcinoma; Recurrent Primary Peritoneal Carcinoma,Fallopian Tube Clear Cell Adenocarcinoma; Ovarian Clear Cell Adenocarcinoma; Recurrent Fallopian Tube Carcinoma; Recurrent Ovarian Carcinoma; Recurrent Primary Peritoneal Carcinoma,PHASE2,13,COMPLETED,National Cancer Institute (NCI),,,,Clinical Data,True,ctgov_completion,ctgov_neg_sample,0,Low,,,0
NRC,2019-02-12,2019-02-12,Gainer,2.59,,,34.77,303.8,NCT00478426,Sunitinib Malate,Endometrial Adenocarcinoma; Endometrial Endometrioid Adenocarcinoma; Endometrial Serous Adenocarcinoma; Recurrent Uterine Corpus Carcinoma; Stage IVA Uterine Corpus Cancer AJCC v7; Stage IVB Uterine Corpus Cancer AJCC v7; Uterine Carcinosarcoma; Uterine Corpus Carcinosarcoma,Endometrial Adenocarcinoma; Endometrial Endometrioid Adenocarcinoma; Endometrial Serous Adenocarcinoma; Recurrent Uterine Corpus Carcinoma; Stage IVA Uterine Corpus Cancer AJCC v7; Stage IVB Uterine Corpus Cancer AJCC v7; Uterine Carcinosarcoma; Uterine Corpus Carcinosarcoma,PHASE2,34,COMPLETED,National Cancer Institute (NCI),,,,Clinical Data,True,ctgov_completion,ctgov_neg_sample,0,Low,,,0
MRK,2019-02-13,2019-02-13,Gainer,0.64,,,60.25,,NCT03933449,pembrolizumab,Esophageal Carcinoma; Esophagogastric Junction Carcinoma,Esophageal Carcinoma; Esophagogastric Junction Carcinoma,PHASE3,123,COMPLETED,Merck Sharp & Dohme LLC,,,,Clinical Data,True,ctgov_completion,ctgov_neg_sample,0,Low,,,0
AMGN,2019-02-13,2019-02-13,Gainer,0.29,,,151.42,,NCT03298867,Teprotumumab,Thyroid Eye Disease; Graves' Orbitopathy,Thyroid Eye Disease; Graves' Orbitopathy,PHASE3,83,COMPLETED,Amgen,,,,Clinical Data,True,ctgov_completion,ctgov_neg_sample,0,Low,,,0
NVS,2019-02-15,2019-02-15,Gainer,0.97,,,60.02,,NCT03136861,AIN457,Spondyloarthritis,Spondyloarthritis,PHASE3,383,COMPLETED,Novartis Pharmaceuticals,,,,Clinical Data,True,ctgov_completion,ctgov_neg_sample,0,Low,,,0
MRK,2019-02-18,2019-02-18,Loser,-0.71,,,60.42,,NCT02447003,Pembrolizumab,Breast Cancer,Breast Cancer,PHASE2,254,COMPLETED,Merck Sharp & Dohme LLC,,,,Clinical Data,True,ctgov_completion,ctgov_neg_sample,0,Low,,,0
LPCN,2019-02-19,2019-02-19,Gainer,0.59,,,28.9,55.3,NCT03868059,LPCN 1021,"Hypogonadism, Male","Hypogonadism, Male",PHASE3,138,COMPLETED,Lipocine Inc.,,,,Clinical Data,True,ctgov_completion,ctgov_neg_sample,0,Low,,,0
NVS,2019-02-21,2019-02-21,Loser,-0.25,,,60.44,,NCT03365791,PDR001,Small Cell Lung Cancer; Gastric Adenocarcinoma; Esophageal Adenocarcinoma; Castration Resistant Prostate Adenocarcinoma; Soft Tissue Sarcoma; Ovarian Adenocarcinoma; Advanced Well-differentiated Neuroendocrine Tumors; Diffuse Large B Cell Lymphoma,Small Cell Lung Cancer; Gastric Adenocarcinoma; Esophageal Adenocarcinoma; Castration Resistant Prostate Adenocarcinoma; Soft Tissue Sarcoma; Ovarian Adenocarcinoma; Advanced Well-differentiated Neuroendocrine Tumors; Diffuse Large B Cell Lymphoma,PHASE2,76,COMPLETED,Novartis Pharmaceuticals,,,,Clinical Data,True,ctgov_completion,ctgov_neg_sample,0,Low,,,0
NRC,2019-02-22,2019-02-22,Gainer,0.1,,,34.49,303.8,NCT06446570,"Durvalumab,Tremelimumab",HNSCC; Head and Neck Neoplasms,HNSCC; Head and Neck Neoplasms,PHASE2,18,COMPLETED,Seoul National University Hospital,,,,Clinical Data,True,ctgov_completion,ctgov_neg_sample,0,Low,,,0
SNY,2019-02-22,2019-02-22,Loser,-0.36,,,31.29,,NCT02817451,Hexaxim®: DTaP-IPV-HB-PRP-T Combined Vaccine,Diphtheria; Tetanus; Pertussis; Hepatitis B; Polio; Human Immunodeficiency Virus Infection,Diphtheria; Tetanus; Pertussis; Hepatitis B; Polio; Human Immunodeficiency Virus Infection,PHASE3,53,COMPLETED,"Sanofi Pasteur, a Sanofi Company",,,,Clinical Data,True,ctgov_completion,ctgov_neg_sample,0,Low,,,0
NRC,2019-02-22,2019-02-22,Gainer,0.1,,,34.49,303.8,NCT02348203,Aspirin,Tobacco Use Disorder,Tobacco Use Disorder,PHASE2,63,COMPLETED,National Cancer Institute (NCI),,,,Clinical Data,True,ctgov_completion,ctgov_neg_sample,0,Low,,,0
NRC,2019-02-25,2019-02-25,Loser,-2.15,,,33.75,303.8,NCT02753764,AZD7624,Corticosteroid Resistant (CR) Asthmatics,Corticosteroid Resistant (CR) Asthmatics,PHASE2,2,COMPLETED,National Jewish Health,,,,Clinical Data,True,ctgov_completion,ctgov_neg_sample,0,Low,,,0
PFE,2019-02-26,2019-02-26,Loser,-0.14,,,29.39,,NCT03248882,Placebo,Nonalcoholic Fatty Liver Disease; Nonalcoholic Steatohepatitis,Nonalcoholic Fatty Liver Disease; Nonalcoholic Steatohepatitis,PHASE2,305,COMPLETED,Pfizer,,,,Clinical Data,True,ctgov_completion,ctgov_neg_sample,0,Low,,,0
NVS,2019-02-27,2019-02-27,Loser,-0.22,,,60.96,,NCT01197300,Zoledronic acid,Osteoporosis,Osteoporosis,PHASE3,25,COMPLETED,Novartis Pharmaceuticals,,,,Clinical Data,True,ctgov_completion,ctgov_neg_sample,0,Low,,,0
NRC,2019-02-28,2019-02-28,Loser,-1.67,,,33.89,303.8,NCT03403777,Avelumab,"Testicular Neoplasms; Neoplasms, Germ Cell and Embryonal; Neoplasms; Testicular Diseases; Gonadal Disorders; Antineoplastic Agents; Molecular Mechanisms of Pharmacological Action","Testicular Neoplasms; Neoplasms, Germ Cell and Embryonal; Neoplasms; Testicular Diseases; Gonadal Disorders; Antineoplastic Agents; Molecular Mechanisms of Pharmacological Action",PHASE2,8,COMPLETED,"National Cancer Institute, Slovakia",,,,Clinical Data,True,ctgov_completion,ctgov_neg_sample,0,Low,,,0
NRC,2019-02-28,2019-02-28,Loser,-1.67,,,33.89,303.8,NCT04451096,Probiotics with prebiotic,Parkinson Disease; Constipation,Parkinson Disease; Constipation,PHASE3,48,COMPLETED,National University of Malaysia,,,,Clinical Data,True,ctgov_completion,ctgov_neg_sample,0,Low,,,0
LXRX,2019-03-01,2019-03-01,Gainer,28.01,4.83,5.8,6.81,614.3,NCT02926950,Sotagliflozin (SAR439954),Type 2 Diabetes Mellitus,Type 2 Diabetes Mellitus,PHASE3,518,COMPLETED,Lexicon Pharmaceuticals,"A Randomized, Double-blind, Placebo-controlled, Parallel-group, Multicenter Study to Evaluate the Efficacy and Safety of Sotagliflozin Added to Metformin in Patients With Type 2 Diabetes Mellitus Who Have Inadequate Glycemic Control on Metformin",RANDOMIZED,2019-02-26,Clinical Data,True,ctgov_crossmatch,ctgov_cross_match,3,Extreme,5.799,High,1
NVS,2019-03-04,2019-03-04,Gainer,0.82,,,61.54,,NCT02888080,ACZ885,Pulmonary Sarcoidosis,Pulmonary Sarcoidosis,PHASE2,40,COMPLETED,Novartis Pharmaceuticals,,,,Clinical Data,True,ctgov_completion,ctgov_neg_sample,0,Low,,,0
SRPT,2019-03-06,2019-03-06,Loser,-11.12,5.66,1.96,132.25,1756.2,NCT01976091,SRP-9004,"Limb-Girdle Muscular Dystrophy, Type 2D","Limb-Girdle Muscular Dystrophy, Type 2D",PHASE1/PHASE2,6,COMPLETED,"Sarepta Therapeutics, Inc.",Phase I/IIA Gene Transfer Clinical Trial for LGMD2D (Alpha-Sarcoglycan Deficiency) Using scAAVrh74.tMCK.hSGCA,NON_RANDOMIZED,2019-03-14,Clinical Data,True,ctgov_crossmatch,ctgov_cross_match,8,High,1.965,Low,0
RHHBY,2019-03-07,2019-03-07,Loser,-0.67,,,26.61,,NCT03280537,Omalizumab,Nasal Polyps; Chronic Rhinosinusitis,Nasal Polyps; Chronic Rhinosinusitis,PHASE3,127,COMPLETED,Hoffmann-La Roche,,,,Clinical Data,True,ctgov_completion,ctgov_neg_sample,0,Low,,,0
OPK,2019-03-08,2019-03-08,Loser,-2.76,,,2.47,952.5,NCT03406377,OPK-88003,Type 2 Diabetes Mellitus,Type 2 Diabetes Mellitus,PHASE2,113,COMPLETED,"OPKO Health, Inc.",,,,Clinical Data,True,ctgov_completion,ctgov_neg_sample,0,Low,,,0
NRC,2019-03-10,2019-03-10,Gainer,1.88,,,34.83,303.8,NCT02877615,S 44819 150 mg twice a day,Post Stroke Recovery,Post Stroke Recovery,PHASE2,585,COMPLETED,Institut de Recherches Internationales Servier,,,,Clinical Data,True,ctgov_completion,ctgov_neg_sample,0,Low,,,0
ABBV,2019-03-11,2019-03-11,Gainer,0.64,,,57.86,,NCT03219216,Glecaprevir/Pibrentasvir,Hepatitis C Virus (HCV),Hepatitis C Virus (HCV),PHASE3,100,COMPLETED,AbbVie,,,,Clinical Data,True,ctgov_completion,ctgov_neg_sample,0,Low,,,0
ALKS,2019-03-12,2019-03-12,Loser,0.0,,,33.16,4970.0,NCT03345979,Aripiprazole Lauroxil,Schizophrenia,Schizophrenia,PHASE3,200,COMPLETED,"Alkermes, Inc.",,,,Clinical Data,True,ctgov_completion,ctgov_neg_sample,0,Low,,,0
ALDX,2019-03-12,2019-03-12,Gainer,11.37,6.78,1.68,8.91,328.5,NCT03709121,Reproxalap Ophthalmic Solution (0.25%),"Conjunctivitis, Allergic","Conjunctivitis, Allergic",PHASE1/PHASE2,70,COMPLETED,"Aldeyra Therapeutics, Inc.",An Exploratory Clinical Trial Evaluating Reproxalap Ophthalmic Solutions (0.25% and 0.5%) in Subjects With Seasonal Allergic Conjunctivitis Using the Environmental Exposure Chamber (EEC),RANDOMIZED,2019-03-20,Clinical Data,True,ctgov_crossmatch,ctgov_cross_match,8,High,1.677,Low,0
GILD,2019-03-13,2019-03-13,Gainer,1.42,,,49.93,,NCT03134222,Lanraplenib,Cutaneous Lupus Erythematosus,Cutaneous Lupus Erythematosus,PHASE2,47,COMPLETED,Gilead Sciences,,,,Clinical Data,True,ctgov_completion,ctgov_neg_sample,0,Low,,,0
SNY,2019-03-17,2019-03-17,Loser,-0.4,,,34.12,,NCT03765437,Quadrivalent Influenza Vaccine,Influenza,Influenza,PHASE3,230,COMPLETED,"Sanofi Pasteur, a Sanofi Company",,,,Clinical Data,True,ctgov_completion,ctgov_neg_sample,0,Low,,,0
NRC,2019-03-18,2019-03-18,Gainer,0.18,,,34.56,303.8,NCT02178241,Eribulin Mesylate,Metastatic Ureter Carcinoma; Metastatic Urethral Carcinoma; Stage III Bladder Urothelial Carcinoma AJCC v6 and v7; Stage III Ureter Cancer AJCC v7; Stage III Urethral Cancer AJCC v7; Stage IV Bladder Urothelial Carcinoma AJCC v7; Stage IV Ureter Cancer AJCC v7; Stage IV Urethral Cancer AJCC v7; Ureter Urothelial Carcinoma; Urethral Urothelial Carcinoma,Metastatic Ureter Carcinoma; Metastatic Urethral Carcinoma; Stage III Bladder Urothelial Carcinoma AJCC v6 and v7; Stage III Ureter Cancer AJCC v7; Stage III Urethral Cancer AJCC v7; Stage IV Bladder Urothelial Carcinoma AJCC v7; Stage IV Ureter Cancer AJCC v7; Stage IV Urethral Cancer AJCC v7; Ureter Urothelial Carcinoma; Urethral Urothelial Carcinoma,PHASE2,26,COMPLETED,National Cancer Institute (NCI),,,,Clinical Data,True,ctgov_completion,ctgov_neg_sample,0,Low,,,0
NRC,2019-03-19,2019-03-19,Loser,-0.33,,,34.45,303.8,NCT01794117,Anakinra,Sneddon-Wilkinson; Acrodermatitis Continua of Hallopeau; Pustular Psoriasis; Palmoplantar Pustulosis,Sneddon-Wilkinson; Acrodermatitis Continua of Hallopeau; Pustular Psoriasis; Palmoplantar Pustulosis,PHASE2,18,COMPLETED,National Institute of Arthritis and Musculoskeletal and Skin Diseases (NIAMS),,,,Clinical Data,True,ctgov_completion,ctgov_neg_sample,0,Low,,,0
CPRX,2019-03-19,2019-03-19,Gainer,12.99,4.78,2.71,3.48,2836.8,NCT03407651,Coagulation Factor VIIa variant,Hemophilia A With Inhibitor; Hemophilia B With Inhibitor,Hemophilia A With Inhibitor; Hemophilia B With Inhibitor,PHASE2,11,COMPLETED,Catalyst Biosciences,"Phase 2 Study to Evaluate the Pharmacokinetics, Efficacy and Safety of a Daily Subcutaneous Treatment Regimen With Marzeptacog Alfa (Activated) for Bleeding Prophylaxis in Adult Subjects With Hemophilia A and B Subjects With an Inhibitor",NON_RANDOMIZED,2019-03-15,Clinical Data,True,ctgov_crossmatch,ctgov_cross_match,4,High,2.718,Low,0
NVS,2019-03-20,2019-03-20,Gainer,0.53,,,64.45,,NCT02712983,TIP,Non-cystic Fibrosis Bronchiectasis,Non-cystic Fibrosis Bronchiectasis,PHASE2,107,COMPLETED,Novartis Pharmaceuticals,,,,Clinical Data,True,ctgov_completion,ctgov_neg_sample,0,Low,,,0
CPRX,2019-03-20,2019-03-20,Gainer,15.52,4.81,3.22,4.02,2836.8,NCT03407651,Coagulation Factor VIIa variant,Hemophilia A With Inhibitor; Hemophilia B With Inhibitor,Hemophilia A With Inhibitor; Hemophilia B With Inhibitor,PHASE2,11,COMPLETED,Catalyst Biosciences,"Phase 2 Study to Evaluate the Pharmacokinetics, Efficacy and Safety of a Daily Subcutaneous Treatment Regimen With Marzeptacog Alfa (Activated) for Bleeding Prophylaxis in Adult Subjects With Hemophilia A and B Subjects With an Inhibitor",NON_RANDOMIZED,2019-03-15,Clinical Data,True,ctgov_crossmatch,ctgov_cross_match,5,High,3.227,Medium,1
NRC,2019-03-21,2019-03-21,Gainer,0.1,,,34.48,303.8,NCT01287026,Cardiac Real-time MRI RHC (Right Heart Catheterization),Caridovascular Disease; Congenital Heart Disease; Pulmonary Hypertension,Caridovascular Disease; Congenital Heart Disease; Pulmonary Hypertension,PHASE1/PHASE2,150,COMPLETED,"National Heart, Lung, and Blood Institute (NHLBI)",,,,Clinical Data,True,ctgov_completion,ctgov_neg_sample,0,Low,,,0
NVS,2019-03-21,2019-03-21,Gainer,0.19,,,64.57,,NCT03005288,BYM338 10 mg/kg,"Diabetes Mellitus, Type 2","Diabetes Mellitus, Type 2",PHASE2,78,COMPLETED,Novartis Pharmaceuticals,,,,Clinical Data,True,ctgov_completion,ctgov_neg_sample,0,Low,,,0
