ticker,event_date,v_actual_date,event_type,move_pct,atr_pct,normalized_move,close,market_cap_m,nct_id,drug_name,indication,ct_conditions,ct_phase,ct_enrollment,ct_status,ct_sponsor,ct_official_title,ct_allocation,ct_primary_completion,catalyst_type,v_is_material,data_tier,match_type,days_offset,move_class_abs,stock_movement_atr_normalized,move_class_norm,target_large_move
LLY,2021-06-21,2021-06-21,Gainer,1.89,,,212.77,,NCT04146363,Lebrikizumab,Atopic Dermatitis,Atopic Dermatitis,PHASE3,424,COMPLETED,Eli Lilly and Company,,,,Clinical Data,True,ctgov_completion,ctgov_neg_sample,0,Low,,,0
LLY,2021-06-22,2021-06-22,Loser,-0.55,,,211.6,,NCT04701658,Bamlanivimab,COVID-19,COVID-19,PHASE2,109,COMPLETED,Eli Lilly and Company,,,,Clinical Data,True,ctgov_completion,ctgov_neg_sample,0,Low,,,0
LPCN,2021-06-24,2021-06-24,Gainer,5.15,,,24.31,55.3,NCT04134091,LPCN 1144 Formulation A,Nonalcoholic Steatohepatitis (NASH),Nonalcoholic Steatohepatitis (NASH),PHASE2,56,COMPLETED,Lipocine Inc.,,,,Clinical Data,True,ctgov_completion,ctgov_neg_sample,0,Medium,,,0
PVLA,2021-06-24,2021-06-24,Gainer,23.45,8.4,2.79,349.6,1598.2,NCT04520750,PTX-022,Pachyonychia Congenita,Pachyonychia Congenita,PHASE3,36,COMPLETED,"Palvella Therapeutics, Inc.","VALO-2: A Multicenter, Phase 3b, Open-Label Treatment Extension Study Evaluating the Safety and Efficacy of PTX022 in the Treatment of Adults With Pachyonychia Congenita",NA,2021-06-30,Clinical Data,True,ctgov_crossmatch,ctgov_cross_match,6,Extreme,2.792,Low,0
DTIL,2021-06-24,2021-06-24,Gainer,5.42,,,338.4,101.1,NCT04030195,PBCAR20A,"Non-Hodgkin's Lymphoma, Relapsed; Chronic Lymphoid Leukemia in Relapse; Non-Hodgkin's Lymphoma Refractory; Chronic Lymphocytic Leukemia; Lymphoma, Non-Hodgkin; Leukemia, Lymphocytic, Chronic; B-cell Chronic Lymphocytic Leukemia; B-cell Non Hodgkin Lymphoma; Small Lymphocytic Lymphoma","Non-Hodgkin's Lymphoma, Relapsed; Chronic Lymphoid Leukemia in Relapse; Non-Hodgkin's Lymphoma Refractory; Chronic Lymphocytic Leukemia; Lymphoma, Non-Hodgkin; Leukemia, Lymphocytic, Chronic; B-cell Chronic Lymphocytic Leukemia; B-cell Non Hodgkin Lymphoma; Small Lymphocytic Lymphoma",PHASE1/PHASE2,18,COMPLETED,"Precision BioSciences, Inc.",,,,Clinical Data,True,ctgov_completion,ctgov_neg_sample,0,Medium,,,0
APLS,2021-06-28,2021-06-28,Gainer,1.54,,,63.97,2679.3,NCT03525613,APL-2,Geographic Atrophy,Geographic Atrophy,PHASE3,637,COMPLETED,"Apellis Pharmaceuticals, Inc.",,,,Clinical Data,True,ctgov_completion,ctgov_neg_sample,0,Low,,,0
NVS,2021-06-29,2021-06-29,Loser,-0.51,,,76.15,,NCT03837184,Onasemnogene Abeparvovec-xioi,Spinal Muscular Atrophy Type I,Spinal Muscular Atrophy Type I,PHASE3,2,COMPLETED,Novartis Gene Therapies,,,,Clinical Data,True,ctgov_completion,ctgov_neg_sample,0,Low,,,0
NRC,2021-07-01,2021-07-01,Gainer,3.51,,,42.41,303.8,NCT03644953,Hydroxyurea,Sickle Cell Disease,Sickle Cell Disease,PHASE2,14,COMPLETED,Children's National Research Institute,,,,Clinical Data,True,ctgov_completion,ctgov_neg_sample,0,Low,,,0
RHHBY,2021-07-06,2021-07-06,Gainer,0.72,,,40.4,,NCT04436744,Giredestrant,Early Breast Cancer,Early Breast Cancer,PHASE2,221,COMPLETED,Hoffmann-La Roche,,,,Clinical Data,True,ctgov_completion,ctgov_neg_sample,0,Low,,,0
BMY,2021-07-07,2021-07-07,Gainer,0.74,,,55.89,,NCT02369653,Apixaban,Lymphoma; Acute Lymphoblastic Leukemia,Lymphoma; Acute Lymphoblastic Leukemia,PHASE3,512,COMPLETED,Bristol-Myers Squibb,,,,Clinical Data,True,ctgov_completion,ctgov_neg_sample,0,Low,,,0
LLY,2021-07-08,2021-07-08,Gainer,0.55,,,226.58,,NCT04476108,LY3016859,Diabetic Peripheral Neuropathic Pain,Diabetic Peripheral Neuropathic Pain,PHASE2,125,COMPLETED,Eli Lilly and Company,,,,Clinical Data,True,ctgov_completion,ctgov_neg_sample,0,Low,,,0
BCRX,2021-07-08,2021-07-08,Gainer,2.27,,,16.25,2190.7,NCT03873116,BCX7353 capsules,"Hereditary Angioedema, HAE","Hereditary Angioedema, HAE",PHASE3,19,COMPLETED,BioCryst Pharmaceuticals,,,,Clinical Data,True,ctgov_completion,ctgov_neg_sample,0,Low,,,0
MRK,2021-07-14,2021-07-14,Gainer,0.01,,,66.89,,NCT02130466,Pembrolizumab,Melanoma; Solid Tumors,Melanoma; Solid Tumors,PHASE1/PHASE2,184,COMPLETED,Merck Sharp & Dohme LLC,,,,Clinical Data,True,ctgov_completion,ctgov_neg_sample,0,Low,,,0
NRC,2021-07-15,2021-07-15,Gainer,0.24,,,44.41,303.8,NCT04209075,Biomebliss,Diabetes,Diabetes,PHASE2,6,COMPLETED,National Institute of Diabetes and Digestive and Kidney Diseases (NIDDK),,,,Clinical Data,True,ctgov_completion,ctgov_neg_sample,0,Low,,,0
BIIB,2021-07-16,2021-07-16,Loser,-1.08,,,324.62,,NCT02623699,Tofersen,Amyotrophic Lateral Sclerosis,Amyotrophic Lateral Sclerosis,PHASE3,176,COMPLETED,Biogen,,,,Clinical Data,True,ctgov_completion,ctgov_neg_sample,0,Low,,,0
NRC,2021-07-17,2021-07-17,Loser,-1.19,,,44.64,303.8,NCT04476992,Nitric Oxide-Sessions,"Hypoxemia; Pneumonia, Viral; Coronavirus Infection","Hypoxemia; Pneumonia, Viral; Coronavirus Infection",PHASE1/PHASE2,20,COMPLETED,Tomsk National Research Medical Center of the Russian Academy of Sciences,,,,Clinical Data,True,ctgov_completion,ctgov_neg_sample,0,Low,,,0
RHHBY,2021-07-19,2021-07-19,Loser,-0.16,,,41.02,,NCT03552393,Mircera,"Anemia; Renal Insufficiency, Chronic","Anemia; Renal Insufficiency, Chronic",PHASE2,40,COMPLETED,Hoffmann-La Roche,,,,Clinical Data,True,ctgov_completion,ctgov_neg_sample,0,Low,,,0
CNTB,2021-07-19,2021-07-19,Gainer,12.59,7.38,1.71,24.77,138.1,NCT04444752,CBP-201,Moderate-to-severe Atopic Dermatitis,Moderate-to-severe Atopic Dermatitis,PHASE2,226,COMPLETED,Connect Biopharm LLC,"A Randomized, Double-Blind, Placebo-Controlled Multi-Centered Study of the Efficacy, Safety, Pharmacokinetics and Pharmacodynamics of CBP-201 in Adult Subjects With Moderate to Severe Atopic Dermatitis",RANDOMIZED,2021-07-28,Clinical Data,True,ctgov_crossmatch,ctgov_cross_match,9,High,1.706,Low,0
PFE,2021-07-20,2021-07-20,Gainer,2.24,,,32.29,,NCT02921919,Talazoparib,Cancer,Cancer,PHASE2,120,COMPLETED,Pfizer,,,,Clinical Data,True,ctgov_completion,ctgov_neg_sample,0,Low,,,0
FBRX,2021-07-21,2021-07-21,Gainer,11.19,6.26,1.79,916.75,378.6,NCT04504279,FB-401,Atopic Dermatitis,Atopic Dermatitis,PHASE2,154,COMPLETED,"Forte Biosciences, Inc.","A Randomized, Double-Blind, Placebo-Controlled, Multicenter, 16-Week Trial to Evaluate the Efficacy and Safety of FB-401 in Children, Adolescent and Adult Subjects (Ages 2 Years and Older) With Mild to Moderate Atopic Dermatitis",RANDOMIZED,2021-07-14,Clinical Data,True,ctgov_crossmatch,ctgov_cross_match,7,High,1.788,Low,0
FBRX,2021-07-22,2021-07-22,Loser,-10.88,7.64,1.42,817.0,378.6,NCT04504279,FB-401,Atopic Dermatitis,Atopic Dermatitis,PHASE2,154,COMPLETED,"Forte Biosciences, Inc.","A Randomized, Double-Blind, Placebo-Controlled, Multicenter, 16-Week Trial to Evaluate the Efficacy and Safety of FB-401 in Children, Adolescent and Adult Subjects (Ages 2 Years and Older) With Mild to Moderate Atopic Dermatitis",RANDOMIZED,2021-07-14,Clinical Data,True,ctgov_crossmatch,ctgov_cross_match,8,High,1.424,Noise,0
CNTB,2021-07-27,2021-07-27,Loser,-11.66,9.41,1.24,21.98,138.1,NCT04444752,CBP-201,Moderate-to-severe Atopic Dermatitis,Moderate-to-severe Atopic Dermatitis,PHASE2,226,COMPLETED,Connect Biopharm LLC,"A Randomized, Double-Blind, Placebo-Controlled Multi-Centered Study of the Efficacy, Safety, Pharmacokinetics and Pharmacodynamics of CBP-201 in Adult Subjects With Moderate to Severe Atopic Dermatitis",RANDOMIZED,2021-07-28,Clinical Data,True,ctgov_crossmatch,ctgov_cross_match,1,High,1.239,Noise,0
ABBV,2021-07-29,2021-07-29,Gainer,0.27,,,100.47,,NCT02049138,Upadacitinib,Rheumatoid Arthritis,Rheumatoid Arthritis,PHASE2,493,COMPLETED,AbbVie,,,,Clinical Data,True,ctgov_completion,ctgov_neg_sample,0,Low,,,0
NRC,2021-07-30,2021-07-30,Gainer,0.44,,,47.11,303.8,NCT03917654,Pfs230D1M-EPA/AS01,Malaria,Malaria,PHASE2,1301,COMPLETED,National Institute of Allergy and Infectious Diseases (NIAID),,,,Clinical Data,True,ctgov_completion,ctgov_neg_sample,0,Low,,,0
NRC,2021-07-31,2021-07-31,Gainer,1.19,,,47.67,303.8,NCT03327844,RET using antibiotics (Ciprofloxacin and Metronidazole),Infected Immature Permanent Teeth,Infected Immature Permanent Teeth,PHASE2,40,COMPLETED,"National University Health System, Singapore",,,,Clinical Data,True,ctgov_completion,ctgov_neg_sample,0,Low,,,0
GRCE,2021-08-03,2021-08-03,Gainer,10.2,6.94,1.47,25.92,66.4,NCT04037085,Ketamine,"Obstetric Pain; Postpartum Depression; Breastfeeding; Pain, Acute; Pain, Chronic; Obstetric Anesthesia Problems; Drug Effect; Opioid Use","Obstetric Pain; Postpartum Depression; Breastfeeding; Pain, Acute; Pain, Chronic; Obstetric Anesthesia Problems; Drug Effect; Opioid Use",PHASE2,8,COMPLETED,"Grace Lim, MD, MS","Evaluation of PK/PD, Breastmilk Transfer, and Effectiveness of Ketamine After Cesarean Delivery - Part 1",NA,2021-08-01,Clinical Data,True,ctgov_crossmatch,ctgov_cross_match,2,High,1.47,Noise,0
NRC,2021-08-03,2021-08-03,Gainer,0.19,,,47.76,303.8,NCT03414814,Osimertinib 80 MG [Tagrisso],Locally Advanced or Metastatic NSCLC,Locally Advanced or Metastatic NSCLC,PHASE2,15,COMPLETED,Seoul National University Hospital,,,,Clinical Data,True,ctgov_completion,ctgov_neg_sample,0,Low,,,0
GRCE,2021-08-04,2021-08-04,Loser,-11.11,8.33,1.33,23.04,66.4,NCT04037085,Ketamine,"Obstetric Pain; Postpartum Depression; Breastfeeding; Pain, Acute; Pain, Chronic; Obstetric Anesthesia Problems; Drug Effect; Opioid Use","Obstetric Pain; Postpartum Depression; Breastfeeding; Pain, Acute; Pain, Chronic; Obstetric Anesthesia Problems; Drug Effect; Opioid Use",PHASE2,8,COMPLETED,"Grace Lim, MD, MS","Evaluation of PK/PD, Breastmilk Transfer, and Effectiveness of Ketamine After Cesarean Delivery - Part 1",NA,2021-08-01,Clinical Data,True,ctgov_crossmatch,ctgov_cross_match,3,High,1.334,Noise,0
NRC,2021-08-06,2021-08-06,Gainer,0.28,,,47.59,303.8,NCT01585402,Etidronate,Arterial Calcification; CD73 Deficiency,Arterial Calcification; CD73 Deficiency,PHASE2,7,COMPLETED,"National Heart, Lung, and Blood Institute (NHLBI)",,,,Clinical Data,True,ctgov_completion,ctgov_neg_sample,0,Low,,,0
NRC,2021-08-06,2021-08-06,Gainer,0.28,,,47.59,303.8,NCT01030900,Campath,Hodgkin Lymphoma; Diffuse Large B-Cell Lymphoma,Hodgkin Lymphoma; Diffuse Large B-Cell Lymphoma,PHASE2,50,COMPLETED,National Cancer Institute (NCI),,,,Clinical Data,True,ctgov_completion,ctgov_neg_sample,0,Low,,,0
AXSM,2021-08-09,2021-08-09,Loser,-46.5,14.27,3.26,27.37,8383.5,NCT04608396,AXS-05,Treatment Resistant Depression; Major Depressive Disorder,Treatment Resistant Depression; Major Depressive Disorder,PHASE2,44,COMPLETED,"Axsome Therapeutics, Inc.","MERIT: A Randomized, Double-blind, Placebo-controlled Study of AXS-05 for Relapse Prevention in Treatment Resistant Depression",RANDOMIZED,2021-07-30,Clinical Data,True,ctgov_crossmatch,ctgov_cross_match,10,Extreme,3.259,Medium,1
NVS,2021-08-10,2021-08-10,Gainer,0.5,,,76.52,,NCT03200717,Pazopanib,Advanced Renal Cell Carcinoma; Metastatic Renal Cell Carcinoma,Advanced Renal Cell Carcinoma; Metastatic Renal Cell Carcinoma,PHASE2,62,COMPLETED,Novartis Pharmaceuticals,,,,Clinical Data,True,ctgov_completion,ctgov_neg_sample,0,Low,,,0
MGNX,2021-08-11,2021-08-11,Gainer,0.53,,,24.7,125.9,NCT02492711,Margetuximab,HER-2 Positive Breast Cancer; Metastatic Neoplasm,HER-2 Positive Breast Cancer; Metastatic Neoplasm,PHASE3,624,COMPLETED,MacroGenics,,,,Clinical Data,True,ctgov_completion,ctgov_neg_sample,0,Low,,,0
LLY,2021-08-11,2021-08-11,Loser,-1.99,,,252.36,,NCT04250337,Lebrikizumab,Atopic Dermatitis,Atopic Dermatitis,PHASE3,228,COMPLETED,Eli Lilly and Company,,,,Clinical Data,True,ctgov_completion,ctgov_neg_sample,0,Low,,,0
ANVS,2021-08-12,2021-08-12,Gainer,12.27,28.28,0.43,41.82,71.0,NCT04524351,Posiphen,Alzheimer Disease; Parkinson Disease,Alzheimer Disease; Parkinson Disease,PHASE1/PHASE2,75,COMPLETED,Annovis Bio Inc.,"A Multicenter, Randomized, Double-Blind, Placebo-Controlled, Dose-Finding Study to Evaluate the Safety, Tolerability, Pharmacokinetic and Pharmacodynamic Effects of Posiphen® in Subjects With Early Alzheimer's Disease (AD) or Early Parkinson's Disease (PD)",RANDOMIZED,2021-08-16,Clinical Data,True,ctgov_crossmatch,ctgov_cross_match,4,High,0.434,Noise,0
NRC,2021-08-15,2021-08-15,Gainer,1.19,,,47.16,303.8,NCT04918797,COVAXIN,SARS-CoV2 Infection,SARS-CoV2 Infection,PHASE2/PHASE3,525,COMPLETED,Bharat Biotech International Limited,,,,Clinical Data,True,ctgov_completion,ctgov_neg_sample,0,Low,,,0
VIR,2021-08-18,2021-08-18,Gainer,10.54,5.32,1.98,46.25,1264.6,NCT04779879,Sotrovimab (Gen1),Covid19,Covid19,PHASE2,354,COMPLETED,"Vir Biotechnology, Inc.","A Multicenter, Randomized, Double-Blind, Parallel Group Phase II Study to Evaluate the Safety, Tolerability and Pharmacokinetics of a Second Generation VIR-7831 Material in Non-Hospitalized Participants With Mild to Moderate Coronavirus Disease 2019 (COVID-19)",RANDOMIZED,2021-08-20,Clinical Data,True,ctgov_crossmatch,ctgov_cross_match,2,High,1.981,Low,0
SCLX,2021-08-20,2021-08-20,Gainer,0.1,,,348.6,57.7,NCT03372161,SP-102,Lumbosacral Radicular Pain,Lumbosacral Radicular Pain,PHASE3,401,COMPLETED,"Scilex Pharmaceuticals, Inc.",,,,Clinical Data,True,ctgov_completion,ctgov_neg_sample,0,Low,,,0
AZN,2021-08-21,2021-08-21,Loser,-0.99,,,106.7,,NCT04723394,AZD7442,COVID-19,COVID-19,PHASE3,910,COMPLETED,AstraZeneca,,,,Clinical Data,True,ctgov_completion,ctgov_neg_sample,0,Low,,,0
NRC,2021-08-24,2021-08-24,Loser,-2.57,,,47.4,303.8,NCT03395405,Nitazoxanide,Gastroenteritis Norovirus,Gastroenteritis Norovirus,PHASE2,31,COMPLETED,National Institute of Allergy and Infectious Diseases (NIAID),,,,Clinical Data,True,ctgov_completion,ctgov_neg_sample,0,Low,,,0
REGN,2021-08-24,2021-08-24,Gainer,0.4,,,665.45,,NCT04709575,REGN5713,Allergic Rhinitis; Conjunctivitis,Allergic Rhinitis; Conjunctivitis,PHASE3,353,COMPLETED,Regeneron Pharmaceuticals,,,,Clinical Data,True,ctgov_completion,ctgov_neg_sample,0,Low,,,0
NRC,2021-08-30,2021-08-30,Loser,-1.32,,,48.0,303.8,NCT04320589,Dexmedetomidine,Pheochromocytoma,Pheochromocytoma,PHASE2,30,COMPLETED,"National Cancer Institute, Egypt",,,,Clinical Data,True,ctgov_completion,ctgov_neg_sample,0,Low,,,0
NRC,2021-09-01,2021-09-01,Loser,-0.24,,,48.08,303.8,NCT03120949,Olokizumab 64 mg SC q4w,Rheumatoid Arthritis,Rheumatoid Arthritis,PHASE3,2106,COMPLETED,"R-Pharm International, LLC",,,,Clinical Data,True,ctgov_completion,ctgov_neg_sample,0,Low,,,0
GILD,2021-09-03,2021-09-03,Loser,-0.53,,,60.35,,NCT04026165,SEL,Diabetic Kidney Disease,Diabetic Kidney Disease,PHASE2,384,COMPLETED,Gilead Sciences,,,,Clinical Data,True,ctgov_completion,ctgov_neg_sample,0,Low,,,0
NRC,2021-09-03,2021-09-03,Loser,-1.66,,,47.62,303.8,NCT02535338,Erlotinib Hydrochloride,Recurrent Lung Non-Small Cell Carcinoma; Stage IV Lung Non-Small Cell Cancer AJCC v7,Recurrent Lung Non-Small Cell Carcinoma; Stage IV Lung Non-Small Cell Cancer AJCC v7,PHASE1/PHASE2,11,COMPLETED,National Cancer Institute (NCI),,,,Clinical Data,True,ctgov_completion,ctgov_neg_sample,0,Low,,,0
RHHBY,2021-09-07,2021-09-07,Loser,-1.13,,,41.56,,NCT02394028,Etrolizumab,Crohn Disease,Crohn Disease,PHASE3,1035,COMPLETED,Hoffmann-La Roche,,,,Clinical Data,True,ctgov_completion,ctgov_neg_sample,0,Low,,,0
PFE,2021-09-08,2021-09-08,Loser,-0.51,,,36.92,,NCT04360187,Crisaborole Ointment,Atopic Dermatitis,Atopic Dermatitis,PHASE3,391,COMPLETED,Pfizer,,,,Clinical Data,True,ctgov_completion,ctgov_neg_sample,0,Low,,,0
NRC,2021-09-09,2021-09-09,Loser,-2.47,,,44.35,303.8,NCT03593655,Dapivirine vaginal ring,HIV Infections,HIV Infections,PHASE2,247,COMPLETED,National Institute of Allergy and Infectious Diseases (NIAID),,,,Clinical Data,True,ctgov_completion,ctgov_neg_sample,0,Low,,,0
NRC,2021-09-13,2021-09-13,Loser,-1.88,,,42.91,303.8,NCT04583956,Placebo,COVID-19,COVID-19,PHASE2,214,COMPLETED,National Institute of Allergy and Infectious Diseases (NIAID),,,,Clinical Data,True,ctgov_completion,ctgov_neg_sample,0,Low,,,0
NVS,2021-09-23,2021-09-23,Gainer,0.93,,,69.3,,NCT03713632,Secukinumab,Hidradenitis Suppurativa,Hidradenitis Suppurativa,PHASE3,545,COMPLETED,Novartis Pharmaceuticals,,,,Clinical Data,True,ctgov_completion,ctgov_neg_sample,0,Low,,,0
AMGN,2021-09-23,2021-09-23,Gainer,0.66,,,186.54,,NCT03777436,Apremilast,Psoriasis,Psoriasis,PHASE3,289,COMPLETED,Amgen,,,,Clinical Data,True,ctgov_completion,ctgov_neg_sample,0,Low,,,0
LLY,2021-09-24,2021-09-24,Loser,-0.22,,,222.1,,NCT03616964,Baricitinib,Systemic Lupus Erythematosus,Systemic Lupus Erythematosus,PHASE3,778,COMPLETED,Eli Lilly and Company,,,,Clinical Data,True,ctgov_completion,ctgov_neg_sample,0,Low,,,0
VNDA,2021-09-24,2021-09-24,Loser,-0.4,,,17.26,526.7,NCT04849559,Tradipitant,Healthy Volunteer,Healthy Volunteer,PHASE1/PHASE2,27,COMPLETED,Vanda Pharmaceuticals,,,,Clinical Data,True,ctgov_completion,ctgov_neg_sample,0,Low,,,0
PFE,2021-09-29,2021-09-29,Gainer,1.14,,,34.56,,NCT04516291,Vupanorsen,Dyslipidemias; Hyperlipidemias; Hyperlipoproteinemias,Dyslipidemias; Hyperlipidemias; Hyperlipoproteinemias,PHASE2,286,COMPLETED,Pfizer,,,,Clinical Data,True,ctgov_completion,ctgov_neg_sample,0,Low,,,0
ABBV,2021-09-29,2021-09-29,Gainer,1.4,,,91.99,,NCT04380142,ABBV-951,Parkinson's Disease (PD),Parkinson's Disease (PD),PHASE3,174,COMPLETED,AbbVie,,,,Clinical Data,True,ctgov_completion,ctgov_neg_sample,0,Low,,,0
ABBV,2021-09-30,2021-09-30,Loser,-0.89,,,91.17,,NCT03738215,Cariprazine,Major Depressive Disorder,Major Depressive Disorder,PHASE3,759,COMPLETED,AbbVie,,,,Clinical Data,True,ctgov_completion,ctgov_neg_sample,0,Low,,,0
PFE,2021-09-30,2021-09-30,Loser,-1.19,,,34.14,,NCT04032093,RSV vaccine,Respiratory Tract Infection,Respiratory Tract Infection,PHASE2,1153,COMPLETED,Pfizer,,,,Clinical Data,True,ctgov_completion,ctgov_neg_sample,0,Low,,,0
LLY,2021-10-01,2021-10-01,Loser,-0.63,,,220.09,,NCT04450407,LY3209590,Type 1 Diabetes Mellitus,Type 1 Diabetes Mellitus,PHASE2,266,COMPLETED,Eli Lilly and Company,,,,Clinical Data,True,ctgov_completion,ctgov_neg_sample,0,Low,,,0
CRDL,2021-10-04,2021-10-04,Loser,-10.13,10.21,0.99,3.55,113.9,NCT03158532,Nitroglycerin I,Injury of Radial Artery,Injury of Radial Artery,PHASE3,2040,COMPLETED,Instituto de Cardiologia de Santa Catarina,Prevention of Radial Artery Occlusion After Transradial Access Using Nitroglycerin,RANDOMIZED,2021-10-01,Clinical Data,True,ctgov_crossmatch,ctgov_cross_match,3,High,0.992,Noise,0
SNY,2021-10-05,2021-10-05,Loser,-0.1,,,41.16,,NCT03347396,BIVV009,"Agglutinin Disease, Cold","Agglutinin Disease, Cold",PHASE3,24,COMPLETED,"Bioverativ, a Sanofi company",,,,Clinical Data,True,ctgov_completion,ctgov_neg_sample,0,Low,,,0
AUPH,2021-10-06,2021-10-06,Loser,-11.42,8.94,1.28,18.85,1868.2,NCT03597464,Voclosporin,Lupus Nephritis,Lupus Nephritis,PHASE3,216,COMPLETED,Aurinia Pharmaceuticals Inc.,"A Randomized, Controlled, Double-blind, Continuation Study Comparing the Long-term Safety and Efficacy of Voclosporin (23.7 mg Twice Daily) With Placebo in Subjects With Lupus Nephritis",RANDOMIZED,2021-10-07,Clinical Data,True,ctgov_crossmatch,ctgov_cross_match,1,High,1.277,Noise,0
OPK,2021-10-08,2021-10-08,Loser,-1.34,,,3.69,952.5,NCT04551911,Rayaldee,COVID-19; Coronavirus; SARS-CoV2 Infection,COVID-19; Coronavirus; SARS-CoV2 Infection,PHASE2,171,COMPLETED,"OPKO Health, Inc.",,,,Clinical Data,True,ctgov_completion,ctgov_neg_sample,0,Low,,,0
SABS,2021-10-08,2021-10-08,Gainer,0.05,,,100.75,195.2,NCT04850898,SAB-176,Influenza A H1N1,Influenza A H1N1,PHASE2,62,COMPLETED,"SAb Biotherapeutics, Inc.",,,,Clinical Data,True,ctgov_completion,ctgov_neg_sample,0,Low,,,0
AZN,2021-10-08,2021-10-08,Gainer,0.4,,,109.99,,NCT03286842,Olaparib,HER2-ve Metastatic Breast Cancer; Germline BRCA1/2 Mutations; Somatic BRCA1/2 Mutations,HER2-ve Metastatic Breast Cancer; Germline BRCA1/2 Mutations; Somatic BRCA1/2 Mutations,PHASE3,256,COMPLETED,AstraZeneca,,,,Clinical Data,True,ctgov_completion,ctgov_neg_sample,0,Low,,,0
PFE,2021-10-10,2021-10-10,Loser,-0.92,,,33.39,,NCT04571060,Zavegepant,Migraine,Migraine,PHASE3,1978,COMPLETED,Pfizer,,,,Clinical Data,True,ctgov_completion,ctgov_neg_sample,0,Low,,,0
PTGX,2021-10-11,2021-10-11,Gainer,93.86,10.86,8.64,35.36,5756.4,NCT04202965,PTG-300,Hereditary Hemochromatosis,Hereditary Hemochromatosis,PHASE2,16,COMPLETED,"Protagonist Therapeutics, Inc.",Open-label Study of PTG-300 in Subjects With Hereditary Hemochromatosis,NA,2021-10-06,Clinical Data,True,ctgov_crossmatch,ctgov_cross_match,5,Extreme,8.643,Extreme,1
MRK,2021-10-11,2021-10-11,Loser,-0.87,,,69.5,,NCT03845140,L-PZQ ODT 50 mg/kg,Schistosomiasis,Schistosomiasis,PHASE3,288,COMPLETED,"Merck KGaA, Darmstadt, Germany",,,,Clinical Data,True,ctgov_completion,ctgov_neg_sample,0,Low,,,0
PTGX,2021-10-12,2021-10-12,Loser,-10.29,12.67,0.81,31.72,5756.4,NCT04202965,PTG-300,Hereditary Hemochromatosis,Hereditary Hemochromatosis,PHASE2,16,COMPLETED,"Protagonist Therapeutics, Inc.",Open-label Study of PTG-300 in Subjects With Hereditary Hemochromatosis,NA,2021-10-06,Clinical Data,True,ctgov_crossmatch,ctgov_cross_match,6,High,0.812,Noise,0
NRC,2021-10-14,2021-10-14,Gainer,0.21,,,38.93,303.8,NCT01993719,Aldesleukin,Metastatic Melanoma,Metastatic Melanoma,PHASE2,33,COMPLETED,National Cancer Institute (NCI),,,,Clinical Data,True,ctgov_completion,ctgov_neg_sample,0,Low,,,0
ABBV,2021-10-15,2021-10-15,Gainer,0.39,,,93.53,,NCT03345849,Upadacitinib,Crohn's Disease,Crohn's Disease,PHASE3,526,COMPLETED,AbbVie,,,,Clinical Data,True,ctgov_completion,ctgov_neg_sample,0,Low,,,0
PFE,2021-10-19,2021-10-19,Gainer,1.86,,,33.41,,NCT04091087,crisaborole ointment,Stasis Dermatitis,Stasis Dermatitis,PHASE2,66,COMPLETED,Pfizer,,,,Clinical Data,True,ctgov_completion,ctgov_neg_sample,0,Low,,,0
RHHBY,2021-10-21,2021-10-21,Gainer,2.26,,,41.26,,NCT02257567,Bendamustine,Lymphoma,Lymphoma,PHASE1/PHASE2,331,COMPLETED,Hoffmann-La Roche,,,,Clinical Data,True,ctgov_completion,ctgov_neg_sample,0,Low,,,0
NVS,2021-10-22,2021-10-22,Gainer,0.3,,,70.42,,NCT03524612,eltrombopag,Immune Thrombocytopenic Purpura (ITP),Immune Thrombocytopenic Purpura (ITP),PHASE2,105,COMPLETED,Novartis Pharmaceuticals,,,,Clinical Data,True,ctgov_completion,ctgov_neg_sample,0,Low,,,0
NRC,2021-10-25,2021-10-25,Gainer,0.58,,,39.0,303.8,NCT03721510,PGT121 + VRC07-523LS,HIV/AIDS,HIV/AIDS,PHASE1/PHASE2,19,COMPLETED,International AIDS Vaccine Initiative,,,,Clinical Data,True,ctgov_completion,ctgov_neg_sample,0,Low,,,0
IFRX,2021-10-28,2021-10-28,Gainer,41.96,7.7,5.45,4.06,62.3,NCT04333420,IFX-1 + BSC,Severe COVID-19 Pneumonia,Severe COVID-19 Pneumonia,PHASE2/PHASE3,399,COMPLETED,InflaRx GmbH,"A Pragmatic Adaptive Randomized, Controlled Phase II/III Multicenter Study of IFX-1 in Patients With Severe COVID-19 Pneumonia",RANDOMIZED,2021-10-31,Clinical Data,True,ctgov_crossmatch,ctgov_cross_match,3,Extreme,5.449,High,1
VRTX,2021-10-29,2021-10-29,Gainer,1.61,,,184.93,,NCT03601637,LUM,Cystic Fibrosis,Cystic Fibrosis,PHASE3,61,COMPLETED,Vertex Pharmaceuticals Incorporated,,,,Clinical Data,True,ctgov_completion,ctgov_neg_sample,0,Low,,,0
GLUE,2021-10-29,2021-10-29,Loser,-13.63,9.24,1.47,23.45,1353.3,NCT03521102,Acetaminophen 1000mg IV,Acute Pain,Acute Pain,PHASE2,162,COMPLETED,Montefiore Medical Center,An ED-based Randomized Trial of IV Acetaminophen Versus IV Hydromorphone for Elderly Adults With Acute Severe Pain,RANDOMIZED,2021-10-30,Clinical Data,True,ctgov_crossmatch,ctgov_cross_match,1,High,1.475,Noise,0
MRK,2021-10-29,2021-10-29,Gainer,1.73,,,76.56,,NCT04016714,V114,Pneumococcal Infections,Pneumococcal Infections,PHASE3,1191,COMPLETED,Merck Sharp & Dohme LLC,,,,Clinical Data,True,ctgov_completion,ctgov_neg_sample,0,Low,,,0
NRC,2021-10-30,2021-10-30,Gainer,6.05,,,41.1,303.8,NCT04560309,L-alanyl-L-glutamine dipeptide,Coronary Artery Bypass; Cardiopulmonary Bypass; Coronary Artery Disease,Coronary Artery Bypass; Cardiopulmonary Bypass; Coronary Artery Disease,PHASE3,60,COMPLETED,National Cardiovascular Center Harapan Kita Hospital Indonesia,,,,Clinical Data,True,ctgov_completion,ctgov_neg_sample,0,Medium,,,0
ACAD,2021-11-01,2021-11-01,Gainer,14.37,4.01,3.59,20.53,4155.1,NCT04181723,Trofinetide,Rett Syndrome,Rett Syndrome,PHASE3,187,COMPLETED,ACADIA Pharmaceuticals Inc.,"A Randomized, Double-Blind, Placebo-Controlled, Parallel-Group Study of Trofinetide for the Treatment of Girls and Women With Rett Syndrome",RANDOMIZED,2021-10-28,Clinical Data,True,ctgov_crossmatch,ctgov_cross_match,4,High,3.584,Medium,1
IFRX,2021-11-01,2021-11-01,Gainer,11.79,7.87,1.5,4.74,62.3,NCT04333420,IFX-1 + BSC,Severe COVID-19 Pneumonia,Severe COVID-19 Pneumonia,PHASE2/PHASE3,399,COMPLETED,InflaRx GmbH,"A Pragmatic Adaptive Randomized, Controlled Phase II/III Multicenter Study of IFX-1 in Patients With Severe COVID-19 Pneumonia",RANDOMIZED,2021-10-31,Clinical Data,True,ctgov_crossmatch,ctgov_cross_match,1,High,1.498,Noise,0
KNSA,2021-11-02,2021-11-02,Gainer,19.01,4.47,4.25,15.15,3372.2,NCT04447469,mavrilimumab,COVID,COVID,PHASE2/PHASE3,814,COMPLETED,"Kiniksa Pharmaceuticals International, plc","A Phase 2/3, Randomized, Double-blind, Placebo-controlled Study to Evaluate the Efficacy and Safety of Mavrilimumab (KPL-301) Treatment in Adult Subjects Hospitalized With Severe COVID-19 Pneumonia and Hyper-inflammation",RANDOMIZED,2021-11-12,Clinical Data,True,ctgov_crossmatch,ctgov_cross_match,10,High,4.253,Medium,1
NRC,2021-11-04,2021-11-04,Loser,-1.41,,,43.23,303.8,NCT04140266,Dapivirine (DPV) Vaginal Ring (VR)-004,HIV Infections,HIV Infections,PHASE3,394,COMPLETED,National Institute of Allergy and Infectious Diseases (NIAID),,,,Clinical Data,True,ctgov_completion,ctgov_neg_sample,0,Low,,,0
ABBV,2021-11-04,2021-11-04,Loser,-0.43,,,100.14,,NCT03873493,Venetoclax,Leukemia; T-cell Prolymphocytic Leukemia (T-PLL); Cancer,Leukemia; T-cell Prolymphocytic Leukemia (T-PLL); Cancer,PHASE2,14,COMPLETED,AbbVie,,,,Clinical Data,True,ctgov_completion,ctgov_neg_sample,0,Low,,,0
